{
  "$schema": "schemas/managed-ci-activated-workflow-contract.schema.json",
  "schemaVersion": 2,
  "kind": "managed-ci-activated-workflow-contract",
  "imageDigestTokens": {
    "{{image:dependency-acquisition}}": "dependency-acquisition",
    "{{image:deterministic-hook-audit}}": "deterministic-hook-audit",
    "{{image:model-broker}}": "model-broker",
    "{{image:github-observer}}": "github-observer"
  },
  "authority": {
    "client": "/opt/qijenchen/managed-ci-authority/bin/managed-ci-authority-client",
    "freezeEnvironment": "managed-ci-freeze-authority-v1",
    "sandboxEnvironment": "managed-ci-sandbox-authority-v1",
    "finalizerEnvironment": "managed-ci-receipt-finalizer-v1",
    "audience": "qijenchen-managed-deep-audit-authority-v1"
  },
  "sandbox": {
    "launcher": "/opt/qijenchen/managed-ci-host/bin/sandbox-launch",
    "policy": "/opt/qijenchen/managed-ci-host/policies/managed-ci-executor-supply-chain.json",
    "candidateIdTokenPermission": "none",
    "candidateCredentials": "none",
    "candidateProcessBoundary": "private-hidepid2",
    "secretAndSignerBoundary": "external-authority-only"
  },
  "frozenSubject": {
    "kind": "managed-ci-frozen-subject-v1",
    "artifactNameTemplate": "managed-ci-frozen-subject-${{ github.run_id }}-${{ github.run_attempt }}",
    "downloadPath": ".managed-ci/frozen-subject",
    "sameArtifactRequiredForAllClasses": true,
    "recomputeSha256ForAllClasses": true
  }
}
